{
  "$ref": "#/definitions/faqs",
  "definitions": {
    "faqs": {
      "type": "object",
      "properties": {
        "question": {
          "type": "string"
        },
        "answer": {
          "type": "string"
        },
        "category": {
          "type": "string"
        },
        "order": {
          "type": "number",
          "default": 0
        },
        "$schema": {
          "type": "string"
        }
      },
      "required": [
        "question",
        "answer",
        "category"
      ],
      "additionalProperties": false
    }
  },
  "$schema": "http://json-schema.org/draft-07/schema#"
}