{
  "question": "What is your working process?",
  "answer": "I follow a data-driven approach: 1) Discovery & Analysis, 2) Strategy Development, 3) Implementation, 4) Optimization & Reporting. Throughout the process, I provide regular updates and maintain transparent communication.",
  "category": "process",
  "order": 3
}
