{
  "question": "How long does a typical project take?",
  "answer": "Most projects are completed within 2-8 weeks depending on scope. Smaller projects like consulting or automation setup typically take 2-4 weeks, while comprehensive strategies may take 6-8 weeks.",
  "category": "process",
  "order": 2
}
